mturk_id,tweet_id,tweet,text,answer,id
0027d7ebf8a84e0a85c6264de57d08d1,988909412147281000,"is stephen miller also part of that ""incel"" group on the internet we are hearing so much about?",Please briefly explain why you believe the intent of this tweet is or is not malicious.,because its  an  serious issue of an every indivual,rhetoric-freetext
0027d7ebf8a84e0a85c6264de57d08d1,991085188544417000,"Today's episode of The Scope News on @CJRU1280 focuses on the Yonge Street van attack. Listen to @ArshyMann go in-depth on the misogynistic ""incel"" culture and Mohini Datta-Ray from @NYWS on how it fits into a long history of violence against women. https://soundcloud.com/scopeatryerson/the-scope-news-april-30th-2018 …",Please briefly explain why you believe the intent of this tweet is or is not malicious.,because its  an  serious issue of an every indivual,rhetoric-freetext
0027d7ebf8a84e0a85c6264de57d08d1,991090416870154000,"ZELDA THOUGHTS: Alright, so now that I know what an “incel” is, I just want to say: if you so frustrated in the sexual sense that you want to commit terrorism or do harm to someone, seek help. Because you obviously have lost it.  I’m a romantic. Really. Like, wedding",Please briefly explain why you believe the intent of this tweet is or is not malicious.,because its  an  serious issue of an every indivual,rhetoric-freetext
0027d7ebf8a84e0a85c6264de57d08d1,991102059251470000,"Son, me acabo de enterar, los ""célibes involuntarios"" InCel en inglés, lo curioso es que se autoproclaman los que lo son. En resumen son los que no pueden conseguir una chica, usando el inglés de nuevo, un loser",Please briefly explain why you believe the intent of this tweet is or is not malicious.,because its  an  serious issue of an every indivual,rhetoric-freetext
0027d7ebf8a84e0a85c6264de57d08d1,988831061860794000,In Calgary getting ready to cover the @grandslamcurl Champions Cup but my thoughts are with those back home affected by yesterday's tragedy. #TorontoStrong,Please briefly explain why you believe the intent of this tweet is or is not malicious.,because its  an  serious issue of an every people.,rhetoric-freetext
0027d7ebf8a84e0a85c6264de57d08d1,991088097013174000,Get the Nasim Aghdam Youtube Shooter tee now! Perfect gift for the lonely incel terrorist in your life!  https://www.teepublic.com/t-shirt/2605254-nasim-aghdam?store_id=154226 … pic.twitter.com/atMAuuS6j2,Please briefly explain why you believe the intent of this tweet is or is not malicious.,because its  an  serious issue of an every people.,rhetoric-freetext
0027d7ebf8a84e0a85c6264de57d08d1,989385336924114000,"Haine des femmes : ce que l'on sait du mouvement ""incel""  https://www.grazia.fr/news-et-societe/societe/haine-des-femmes-ce-que-l-on-sait-du-mouvement-incel-886245 … via @grazia_fr",Please briefly explain why you believe the intent of this tweet is or is not malicious.,because its  an  serious issue of an every people.,rhetoric-freetext
0027d7ebf8a84e0a85c6264de57d08d1,991102329133916000,Tonight is a busy night so I will be tweeting out some cool people to go watch #1 @ThatSmoothJazz streaming Fortnite for the chairty #Torontostrong  http://www.twitch.tv/thatsmoothjazz?sr=a …,Please briefly explain why you believe the intent of this tweet is or is not malicious.,because its  an  serious issue of an every people.,rhetoric-freetext
0027d7ebf8a84e0a85c6264de57d08d1,991100091317579000,incel? is this a new thing?,Please briefly explain why you believe the intent of this tweet is or is not malicious.,because its  an  serious issue of an every people.,rhetoric-freetext
0027d7ebf8a84e0a85c6264de57d08d1,991078544821444000,"A todos los INCEL o estas personas que se creen con derecho a follar porque sí, espero que los seres mas horrorosos del planeta les violen por que les apetecía follar. Que coño es esto de exigir que alguien se deje follar por ti?",Please briefly explain why you believe the intent of this tweet is or is not malicious.,because its  an  serious issue of an every people.,rhetoric-freetext